{
  "schema_version": 1,
  "brand": "cueson",
  "kit_version": "1.0.0",
  "source_url": "https://brand.shruggie.tech/cueson/downloads/cueson-brand-1.0.0.zip",
  "effective_url": "https://brand.shruggie.tech/cueson/downloads/cueson-brand-1.0.0.zip",
  "acquired_at": "2026-09-10T21:22:18Z",
  "archive": {
    "path": "brand/cueson/1.0.0/archive/cueson-brand-1.0.0.zip",
    "bytes": 3889985,
    "sha256": "095e572a0db73472c9fdcf5001f68e702105a3d0ec1fcc34f830ae57c608cd07",
    "entry_count": 265,
    "uncompressed_bytes": 5469058
  },
  "payload_root": "brand/cueson/1.0.0/kit",
  "entries": [
    {
      "path": "LICENSE",
      "bytes": 11358,
      "sha256": "cfc7749b96f63bd31c3c42b5c471bf756814053e847c10f3eb003417bc523d30"
    },
    {
      "path": "LICENSE-BRAND.md",
      "bytes": 2339,
      "sha256": "bd1107a804108bbe02955ca64000945322a6fc2456b45b795dac11a253c0023a"
    },
    {
      "path": "NOTES.md",
      "bytes": 1654,
      "sha256": "31e4b6554e85f8b29bcf3a950eda05ad0003c8e5db5359fa4ffaf6ae822e96f8"
    },
    {
      "path": "NOTICE",
      "bytes": 1064,
      "sha256": "d919688fd2c931500447418b628dfd0acf4d82c88d7eb392692bb629f7d0193f"
    },
    {
      "path": "README.md",
      "bytes": 3122,
      "sha256": "e9438a644fcc5ea072b29c68005319f61b120c97524ef1b2602b63af152e2d02"
    },
    {
      "path": "SKILL.md",
      "bytes": 1934,
      "sha256": "96fbaec72d6ab0016eec36f044a42dc6cae43ed73447764900d3e21509d2964a"
    },
    {
      "path": "VERIFY.md",
      "bytes": 2408,
      "sha256": "bf84c31f6e34856e50098a215cc4a1e17a7ca7d5496a1e80f466b624e88058a1"
    },
    {
      "path": "brand-guide.pdf",
      "bytes": 202048,
      "sha256": "5efad8b9835cfaf9d7b0329b54e6da198ee404f31ced47661446182b5ed75d76"
    },
    {
      "path": "brand.json",
      "bytes": 21483,
      "sha256": "aaba14b86f138e796dd2fa5e0ec24dfc2489754348942cb1d166142ba6cc351c"
    },
    {
      "path": "build/brand-guide.print.html",
      "bytes": 471056,
      "sha256": "7cba229cbb439e707378b2de59f9ef616f7c5a4f80f3406dce791b394cbd2e9d"
    },
    {
      "path": "build/mk_paths.py",
      "bytes": 1772,
      "sha256": "ac7580d13c0922e41e5ae1508deaa584d848a747d584b6a1928055005f79f20c"
    },
    {
      "path": "components/README.md",
      "bytes": 692,
      "sha256": "c04cca67a035287e2df675235b574d3acef66614aa24cdfe9ef1b1f5f8341d24"
    },
    {
      "path": "components/components.css",
      "bytes": 5749,
      "sha256": "724ff090a9f3fba26bac18544134e9a400c3ed96ba4274627333ec8cf6f82f22"
    },
    {
      "path": "components/core/Badge.jsx",
      "bytes": 133,
      "sha256": "233ac7c4d0cccf9e7bde61f195b5c1bd8a411184fa2dafb0e545bb319b39bf75"
    },
    {
      "path": "components/core/Button.jsx",
      "bytes": 213,
      "sha256": "26ec1691af2bd4d866397a2647882ab09100d34a712d44bf617ad62463e3cb00"
    },
    {
      "path": "components/core/Card.jsx",
      "bytes": 112,
      "sha256": "5075bb5b95b54e75c7de9733e2f5e98c62967f34ac7cd631ea429e6f88057a86"
    },
    {
      "path": "components/core/CueRow.jsx",
      "bytes": 480,
      "sha256": "30222d01b28fd83854f1df901ab3ed41e6aa179b91b361474b6122dde1f8ecfb"
    },
    {
      "path": "components/core/DerivationRecord.jsx",
      "bytes": 528,
      "sha256": "5980a3c3028742be2d44de7dd1c2e6e17bf0847c4755aaddcbbebf78b4307e64"
    },
    {
      "path": "components/core/Divider.jsx",
      "bytes": 70,
      "sha256": "c48671a8559038b001cb5667611b910b55ed5fbd75d3e381fd0939e2e32d8edf"
    },
    {
      "path": "components/core/SectionHeading.jsx",
      "bytes": 330,
      "sha256": "b41a9c2a07f00729d5bd566590bd7ad1e727eba261373746222a0e1539e72b24"
    },
    {
      "path": "components/core/SourceEnvelope.jsx",
      "bytes": 514,
      "sha256": "9457200009bec4e6c953ffee904730397025a91a1546d2d19a07ff38925226b7"
    },
    {
      "path": "components/forms/Input.jsx",
      "bytes": 465,
      "sha256": "a6d1b2f008cfbd70ae03535b81dbb53d03af1b018c04145bccbd9edf32c0c149"
    },
    {
      "path": "components/forms/Select.jsx",
      "bytes": 482,
      "sha256": "1316a1a4068cad34050d473f222c58a86439a1a0d9ecb580fa07d3bfcadecbac"
    },
    {
      "path": "components/forms/Textarea.jsx",
      "bytes": 459,
      "sha256": "9ff59b5560652f2d3e8098cd5f337665ab614f5dd28fa16caf2b74e3839a4027"
    },
    {
      "path": "consumer-handoff.json",
      "bytes": 6495,
      "sha256": "5974b9408a6d7c35b7389e8930db553ee9658701079af23b6bb88da2e3009b18"
    },
    {
      "path": "enforcement/AGENTS.md",
      "bytes": 4378,
      "sha256": "e84da417e7a4dd71925d3f2f189cf64a61193baad940f404ccad7f7ec60a5523"
    },
    {
      "path": "enforcement/README.md",
      "bytes": 682,
      "sha256": "fc3ac19922ed38a7e669877ee6d0987249d38607767c7bc827d74f724e935ab3"
    },
    {
      "path": "enforcement/eslint.brand.mjs",
      "bytes": 7405,
      "sha256": "64237f59099a2269d974a89d30ee4cad3369dad403d4dc2975749464d6a90564"
    },
    {
      "path": "enforcement/stylelint.config.json",
      "bytes": 378,
      "sha256": "bdc4a9825599b7226830458512eac3a3674ba126324874e0256e13d9d7da9476"
    },
    {
      "path": "favicons/android-chrome-192x192.png",
      "bytes": 4095,
      "sha256": "a616604532b3c58fb7b2eb44163d13b166da1ee5541601bee58807d39a936027"
    },
    {
      "path": "favicons/android-chrome-512x512.png",
      "bytes": 11888,
      "sha256": "0b81f22210b6cbbe5a84e791443b85ed19613dac805675b25499ed7903f30805"
    },
    {
      "path": "favicons/apple-touch-icon.png",
      "bytes": 4007,
      "sha256": "9752b5e852b40155017b10e2d3882b5c78b624078d61366a609cadc8c49cf82f"
    },
    {
      "path": "favicons/favicon-128x128.png",
      "bytes": 2813,
      "sha256": "533b64a42d953a5691e906fa0cde000535f0d6f44c4f94bba92bd50081179ebc"
    },
    {
      "path": "favicons/favicon-16x16.png",
      "bytes": 466,
      "sha256": "ed09fc504e2c7b57ef0f2b4ecd27ed3f92d13e8781210debe53238f731cc7197"
    },
    {
      "path": "favicons/favicon-180x180.png",
      "bytes": 4007,
      "sha256": "9752b5e852b40155017b10e2d3882b5c78b624078d61366a609cadc8c49cf82f"
    },
    {
      "path": "favicons/favicon-192x192.png",
      "bytes": 4095,
      "sha256": "a616604532b3c58fb7b2eb44163d13b166da1ee5541601bee58807d39a936027"
    },
    {
      "path": "favicons/favicon-24x24.png",
      "bytes": 599,
      "sha256": "833ba944ae1026f6d355b76324d899a0949151b4c6bbfbf05494170aa5c3f22e"
    },
    {
      "path": "favicons/favicon-256x256.png",
      "bytes": 5616,
      "sha256": "cf15dda3062e3054f88f1adaf70ccb926892ade44c5b50a7e16fb712c4df9443"
    },
    {
      "path": "favicons/favicon-32x32.png",
      "bytes": 742,
      "sha256": "9245873363dcd8118247934618f5b1d7245f3d87c4070a6f078d28d7cbf2b9aa"
    },
    {
      "path": "favicons/favicon-48x48.png",
      "bytes": 1312,
      "sha256": "eb687c42a03b254c59394c1c75ac3e657dad6f1f462ca593c01d9b10498ff040"
    },
    {
      "path": "favicons/favicon-512x512.png",
      "bytes": 11888,
      "sha256": "0b81f22210b6cbbe5a84e791443b85ed19613dac805675b25499ed7903f30805"
    },
    {
      "path": "favicons/favicon-64x64.png",
      "bytes": 1608,
      "sha256": "368aa8612c61a511eddf6750a7066a1d495fd1adf3838135aafd84161c9de28e"
    },
    {
      "path": "favicons/favicon-full.svg",
      "bytes": 4709,
      "sha256": "549fc18e4b0a43bc4e2ed2eddb5393ef93ffe82277af581dddc3e71e338a1d4b"
    },
    {
      "path": "favicons/favicon.ico",
      "bytes": 13274,
      "sha256": "a8df37c7d9e8501014b005579c0dbf14c5eba4087e626ad5289250224233b19a"
    },
    {
      "path": "favicons/favicon.svg",
      "bytes": 3845,
      "sha256": "0d5dff14b7fc04a8bcfce0a80d57c68471b85a8d07b217a139ea4e62c4450028"
    },
    {
      "path": "favicons/site.webmanifest",
      "bytes": 438,
      "sha256": "ba09793d635e6503a2fbca2c91dd633eef0be766a13bcb44b0ac2744897bb5f0"
    },
    {
      "path": "fonts/README.md",
      "bytes": 988,
      "sha256": "46342f806f3cff108f0ef136bec41234539ac8168917c464358b1ad08cf39d97"
    },
    {
      "path": "fonts/fonts.css",
      "bytes": 848,
      "sha256": "a0dca3df29d9275788f8f69ee2190cbe26c6e9fc4cbda021218f64db09016287"
    },
    {
      "path": "fonts/licenses/OFL-Geist.txt",
      "bytes": 4383,
      "sha256": "942560b236adfa83745b2c64e5fc09ebaf91cb331751b1157eb92187e5d6e930"
    },
    {
      "path": "fonts/licenses/OFL-Space-Grotesk.txt",
      "bytes": 4401,
      "sha256": "18a4de52385f6b988782639d5d0cc1326e5a8c2de9a7f01d7b20d9aedcc60943"
    },
    {
      "path": "fonts/ttf/Geist-Medium.ttf",
      "bytes": 90528,
      "sha256": "b649842011528395954b56221749719041cc6a7b84cb4d29d4f5189338cb62df"
    },
    {
      "path": "fonts/ttf/Geist-Regular.ttf",
      "bytes": 90440,
      "sha256": "43065e72260288e84672cd1f27e1a8f8889b636a74f5f9252649365c41e8eca8"
    },
    {
      "path": "fonts/ttf/GeistMono-Regular.ttf",
      "bytes": 101868,
      "sha256": "990f0e094fe02b8872429209c09abf4c03d22183c33c2a2ddb891dc7f086271c"
    },
    {
      "path": "fonts/ttf/SpaceGrotesk-Bold.ttf",
      "bytes": 88404,
      "sha256": "4372b0b9200ee5f40edbfbe46285f1048afd4cea35ee62999f8f4fef93395022"
    },
    {
      "path": "fonts/ttf/SpaceGrotesk-Medium.ttf",
      "bytes": 88500,
      "sha256": "9483bddc72cef2760eae1f432ecb7d2c9fd537c99768d57d29fefcbb08fa0a68"
    },
    {
      "path": "fonts/woff2/Geist-Medium.woff2",
      "bytes": 46356,
      "sha256": "0b50074337a05ed834a1474d3d13fc6bd8480e2ce3075d02f1d38c017a8ac2a4"
    },
    {
      "path": "fonts/woff2/Geist-Regular.woff2",
      "bytes": 45172,
      "sha256": "faed18848df4a6e1b5503b589bbbc055fbdab0e1780781edf5105457395e1e5d"
    },
    {
      "path": "fonts/woff2/GeistMono-Regular.woff2",
      "bytes": 50196,
      "sha256": "c88d20967768754cbdca230acd74ecb25de78d0dc47e31694aa8bd2c528fec26"
    },
    {
      "path": "fonts/woff2/SpaceGrotesk-Bold.woff2",
      "bytes": 31560,
      "sha256": "cdaf8bb228ee112c0ab784d9edd2b877cb096bad24cbbf88babeedebe197e742"